{
  "schemaVersion": 1,
  "pythonVersion": "3.13.14",
  "distributionRelease": "20260610",
  "releaseCommit": "f1d7b92301235781d4de2493578773aaa413c0a5",
  "platforms": {
    "macos-arm64": {
      "metadataSource": {
        "url": "https://github.com/astral-sh/python-build-standalone/releases/download/20260610/cpython-3.13.14%2B20260610-aarch64-apple-darwin-pgo%2Blto-full.tar.zst",
        "sha256": "f8b07ffcaf10b1e3586665a848ad295a7d58453a248beac9da2f5f15861dad65",
        "size": 58342192,
        "expandedTarBytes": 260812800,
        "expandedTarSha256": "bd12df8109d84004fc606b6ad31eb290435c28f3bc1cb8d0a04a05b2a3af315a",
        "targetTriple": "aarch64-apple-darwin",
        "buildOptions": [
          "pgo",
          "lto"
        ],
        "pythonJson": {
          "path": "python/PYTHON.json",
          "sha256": "0b1dea1de856d336bf9fde9a290b971ee808f53067dff5ac5ed5f755a4c6ae43"
        }
      },
      "externalSystemDependenciesScope": "locked-payload-native-imports-excluding-baseline-loader-libraries",
      "externalSystemDependencies": [
        "AppKit.framework",
        "ApplicationServices.framework",
        "Carbon.framework",
        "Cocoa.framework",
        "CoreFoundation.framework",
        "CoreGraphics.framework",
        "CoreServices.framework",
        "CoreText.framework",
        "Foundation.framework",
        "IOKit.framework",
        "QuartzCore.framework",
        "Security.framework",
        "SystemConfiguration.framework",
        "UniformTypeIdentifiers.framework",
        "libSystem",
        "libedit",
        "libncurses",
        "libobjc",
        "libpanel",
        "libz"
      ],
      "components": [
        {
          "name": "cpython",
          "version": "3.13.14",
          "relationship": "CONTAINS",
          "disposition": "payload",
          "licenseDeclared": "Python-2.0",
          "source": {
            "kind": "archive",
            "url": "https://www.python.org/ftp/python/3.13.14/Python-3.13.14.tar.xz",
            "sha256": "639e43243c620a308f968213df9e00f2f8f62332f7adbaa7a7eeb9783057c690"
          },
          "evidenceOrigins": [
            {
              "url": "https://github.com/astral-sh/python-build-standalone/releases/download/20260610/cpython-3.13.14%2B20260610-aarch64-apple-darwin-pgo%2Blto-full.tar.zst",
              "sha256": "f8b07ffcaf10b1e3586665a848ad295a7d58453a248beac9da2f5f15861dad65"
            }
          ],
          "licenseEvidence": [
            {
              "kind": "metadata-file",
              "path": "python/licenses/LICENSE.cpython.txt",
              "sha256": "86e61415828a8b5b06ec8d024e6f086ce155a8b85fd0c419c0ba4dc004e74fdd"
            }
          ]
        },
        {
          "name": "hacl-star",
          "version": "bb3d0dc8d9d15a5cd51094d5b69e70aa09005ff0",
          "relationship": "STATIC_LINK",
          "disposition": "payload",
          "licenseDeclared": "MIT AND Apache-2.0",
          "source": {
            "kind": "archive",
            "url": "https://github.com/hacl-star/hacl-star/archive/bb3d0dc8d9d15a5cd51094d5b69e70aa09005ff0.zip",
            "sha256": "e31e4ca10da91c585793c0eaf1b98aee3cb43e3a58d3d8d478593e5a6bd82927"
          },
          "evidenceOrigins": [
            {
              "url": "https://github.com/hacl-star/hacl-star/archive/bb3d0dc8d9d15a5cd51094d5b69e70aa09005ff0.zip",
              "sha256": "e31e4ca10da91c585793c0eaf1b98aee3cb43e3a58d3d8d478593e5a6bd82927"
            },
            {
              "url": "https://www.python.org/ftp/python/3.13.14/Python-3.13.14.tar.xz",
              "sha256": "639e43243c620a308f968213df9e00f2f8f62332f7adbaa7a7eeb9783057c690"
            }
          ],
          "licenseEvidence": [
            {
              "kind": "source-archive-member",
              "path": "hacl-star-bb3d0dc8d9d15a5cd51094d5b69e70aa09005ff0/LICENSE",
              "archiveSha256": "e31e4ca10da91c585793c0eaf1b98aee3cb43e3a58d3d8d478593e5a6bd82927",
              "memberSha256": "c5accbbd8546e94c34aed24afe689a617627d18eed5a6c48277e48db57c23851"
            },
            {
              "kind": "source-archive-member",
              "path": "Python-3.13.14/Modules/_hacl/Hacl_Hash_MD5.c",
              "archiveSha256": "639e43243c620a308f968213df9e00f2f8f62332f7adbaa7a7eeb9783057c690",
              "memberSha256": "f71cf6a0e8f09354c2af2c785a1d36e0cba7613a589be01ca8a3d8478f4c8874"
            },
            {
              "kind": "source-archive-member",
              "path": "Python-3.13.14/Modules/_hacl/include/krml/FStar_UInt128_Verified.h",
              "archiveSha256": "639e43243c620a308f968213df9e00f2f8f62332f7adbaa7a7eeb9783057c690",
              "memberSha256": "455e94f24a0900deda7e6e36f4714e4253d32cea077f97e23f90c569a717bc48"
            }
          ]
        },
        {
          "name": "libb2",
          "version": "0.98.1",
          "relationship": "STATIC_LINK",
          "disposition": "payload",
          "licenseDeclared": "CC0-1.0",
          "source": {
            "kind": "archive",
            "url": "https://github.com/BLAKE2/libb2/releases/download/v0.98.1/libb2-0.98.1.tar.gz",
            "sha256": "53626fddce753c454a3fea581cbbc7fe9bbcf0bc70416d48fdbbf5d87ef6c72e"
          },
          "evidenceOrigins": [
            {
              "url": "https://www.python.org/ftp/python/3.13.14/Python-3.13.14.tar.xz",
              "sha256": "639e43243c620a308f968213df9e00f2f8f62332f7adbaa7a7eeb9783057c690"
            }
          ],
          "licenseEvidence": [
            {
              "kind": "source-archive-member",
              "path": "Python-3.13.14/Modules/_blake2/impl/blake2.h",
              "archiveSha256": "639e43243c620a308f968213df9e00f2f8f62332f7adbaa7a7eeb9783057c690",
              "memberSha256": "2f6c9d0ecf70be474f2853b52394993625a32960e0a64eae147ef97a3a5c1460"
            }
          ]
        },
        {
          "name": "macholib",
          "version": "1.0",
          "relationship": "CONTAINS",
          "disposition": "payload",
          "licenseDeclared": "MIT OR PSF-2.0",
          "source": {
            "kind": "archive",
            "url": "https://files.pythonhosted.org/packages/ec/57/f0a712efc3ed982cf4038a3cee172057303b9be914c32c93b2fbec27f785/macholib-1.0.tar.gz",
            "sha256": "c76f268f5054024e962f2515a0e522baf85313064f6740d80375afc850787a38"
          },
          "evidenceOrigins": [
            {
              "url": "https://github.com/astral-sh/python-build-standalone/releases/download/20260610/cpython-3.13.14%2B20260610-aarch64-apple-darwin-pgo%2Blto-full.tar.zst",
              "sha256": "f8b07ffcaf10b1e3586665a848ad295a7d58453a248beac9da2f5f15861dad65"
            },
            {
              "url": "https://www.python.org/ftp/python/3.13.14/Python-3.13.14.tar.xz",
              "sha256": "639e43243c620a308f968213df9e00f2f8f62332f7adbaa7a7eeb9783057c690"
            }
          ],
          "licenseEvidence": [
            {
              "kind": "source-archive-member",
              "path": "Python-3.13.14/Lib/ctypes/macholib/README.ctypes",
              "archiveSha256": "639e43243c620a308f968213df9e00f2f8f62332f7adbaa7a7eeb9783057c690",
              "memberSha256": "dc29d1da83b6a0a09a41647e4111eee878ed079c2d6b54a98fd6d8b88dd581f2"
            },
            {
              "kind": "metadata-file",
              "path": "python/licenses/LICENSE.cpython.txt",
              "sha256": "86e61415828a8b5b06ec8d024e6f086ce155a8b85fd0c419c0ba4dc004e74fdd"
            }
          ]
        },
        {
          "name": "mimalloc",
          "version": "2.1.2",
          "relationship": "STATIC_LINK",
          "disposition": "payload",
          "licenseDeclared": "MIT",
          "source": {
            "kind": "archive",
            "url": "https://github.com/microsoft/mimalloc/archive/refs/tags/v2.1.2.tar.gz",
            "sha256": "2b1bff6f717f9725c70bf8d79e4786da13de8a270059e4ba0bdd262ae7be46eb"
          },
          "evidenceOrigins": [
            {
              "url": "https://github.com/microsoft/mimalloc/archive/refs/tags/v2.1.2.tar.gz",
              "sha256": "2b1bff6f717f9725c70bf8d79e4786da13de8a270059e4ba0bdd262ae7be46eb"
            },
            {
              "url": "https://www.python.org/ftp/python/3.13.14/Python-3.13.14.tar.xz",
              "sha256": "639e43243c620a308f968213df9e00f2f8f62332f7adbaa7a7eeb9783057c690"
            }
          ],
          "licenseEvidence": [
            {
              "kind": "source-archive-member",
              "path": "mimalloc-2.1.2/LICENSE",
              "archiveSha256": "2b1bff6f717f9725c70bf8d79e4786da13de8a270059e4ba0bdd262ae7be46eb",
              "memberSha256": "19c99805e7a44a34b297a75d1edea9985e300066dfc024d5c99d4236d4573b5d"
            },
            {
              "kind": "source-archive-member",
              "path": "Python-3.13.14/Include/internal/mimalloc/mimalloc.h",
              "archiveSha256": "639e43243c620a308f968213df9e00f2f8f62332f7adbaa7a7eeb9783057c690",
              "memberSha256": "7c4e2fc555724fe674efbb2cfe64344fafa86f8c43d22e48263c33dd07ac7d81"
            }
          ]
        },
        {
          "name": "bzip2",
          "version": "1.0.8",
          "relationship": "STATIC_LINK",
          "disposition": "payload",
          "licenseDeclared": "bzip2-1.0.6",
          "source": {
            "kind": "archive",
            "url": "https://astral-sh.github.io/mirror/files/bzip2-1.0.8.tar.gz",
            "sha256": "ab5a03176ee106d3f0fa90e381da478ddae405918153cca248e682cd0c4a2269"
          },
          "evidenceOrigins": [
            {
              "url": "https://github.com/astral-sh/python-build-standalone/releases/download/20260610/cpython-3.13.14%2B20260610-aarch64-apple-darwin-pgo%2Blto-full.tar.zst",
              "sha256": "f8b07ffcaf10b1e3586665a848ad295a7d58453a248beac9da2f5f15861dad65"
            }
          ],
          "licenseEvidence": [
            {